2025-08-01 09:27:15,782 - INFO - Loading parameters from: C:\Users\Mateusz\source\repos\portfolio-backtester\config\parameters.yaml
2025-08-01 09:27:15,834 - INFO - Loading scenarios from: C:\Users\Mateusz\source\repos\portfolio-backtester\config\scenarios
2025-08-01 09:27:16,035 - INFO - Successfully loaded configuration: 41 scenarios found
2025-08-01 09:27:16,035 - INFO - Configuration loaded successfully
2025-08-01 09:27:16,690 - INFO - Loaded negative cache with 3 entries.
2025-08-01 09:27:16,750 - INFO - Skipping 3 tickers found in negative cache for the range 2013-01-01-2025-06-30.
2025-08-01 09:27:16,750 - INFO - Fetching data for 55 tickers from 2013-01-01 to 2025-06-30
2025-08-01 09:27:16,753 - INFO - Fetching data from stooq for 55 tickers
2025-08-01 09:27:16,754 - INFO - Fetching data from Stooq for 55 tickers from 2013-01-01 to 2025-06-30.
Downloading data... -------------------------------------- 100% 0:00:00 0:00:00
2025-08-01 09:27:17,196 - INFO - Data fetching from Stooq complete.
2025-08-01 09:27:17,271 - INFO - stooq results: 55 successful, 0 failed
Fetching from stooq... ----------------------------------- 100% 0:00:00 0:00:00
2025-08-01 09:27:17,287 - INFO - Data fetching complete: 55/55 tickers successful
2025-08-01 09:27:17,287 - INFO - Source usage: 0 from Stooq only, 0 from yfinance fallback
[I 2025-08-01 09:27:17,769] Using an existing study with name 'fixed_weight_spy_gld_sortino_optimization_optuna' instead of creating a new one.
2025-08-01 09:27:17,779 - INFO - Running optimisation in a single process (100 trials)
[I 2025-08-01 09:27:17,845] Using an existing study with name 'fixed_weight_spy_gld_sortino_optimization_optuna' instead of creating a new one.
2025-08-01 09:27:17,853 - INFO - Worker 1004 starting 100 trials
2025-08-01 09:27:18,018 - INFO - Trial 100 started
[I 2025-08-01 09:27:20,414] Trial 100 finished with value: 1.4180224426862413 and parameters: {'rebalance_frequency': 'ME', 'spy_weight': 0.35000000000000003, 'gld_weight': 0.95}. Best is trial 14 with value: 1.649680931444815.
2025-08-01 09:27:20,467 - INFO - Trial 101 started
[I 2025-08-01 09:27:22,496] Trial 101 finished with value: 1.649680931444815 and parameters: {'rebalance_frequency': 'ME', 'spy_weight': 0.95, 'gld_weight': 0.9000000000000001}. Best is trial 14 with value: 1.649680931444815.
2025-08-01 09:27:22,544 - INFO - Trial 102: Using cached value 1.649681 for duplicate parameters
[I 2025-08-01 09:27:22,563] Trial 102 finished with value: 1.649680931444815 and parameters: {'rebalance_frequency': 'ME', 'spy_weight': 0.95, 'gld_weight': 0.9000000000000001}. Best is trial 14 with value: 1.649680931444815.
2025-08-01 09:27:22,613 - INFO - Trial 103 started
[I 2025-08-01 09:27:24,670] Trial 103 finished with value: 1.6496694517073227 and parameters: {'rebalance_frequency': 'ME', 'spy_weight': 0.9000000000000001, 'gld_weight': 0.8500000000000001}. Best is trial 14 with value: 1.649680931444815.
2025-08-01 09:27:24,737 - INFO - Trial 104 started
[I 2025-08-01 09:27:26,697] Trial 104 finished with value: 1.6457203935909963 and parameters: {'rebalance_frequency': 'ME', 'spy_weight': 0.95, 'gld_weight': 0.8}. Best is trial 14 with value: 1.649680931444815.
2025-08-01 09:27:26,746 - INFO - Trial 105 started
[I 2025-08-01 09:27:28,624] Trial 105 finished with value: 1.6468102933675182 and parameters: {'rebalance_frequency': 'ME', 'spy_weight': 0.9000000000000001, 'gld_weight': 0.95}. Best is trial 14 with value: 1.649680931444815.
2025-08-01 09:27:28,672 - INFO - Trial 106: Using cached value 1.649681 for duplicate parameters
[I 2025-08-01 09:27:28,691] Trial 106 finished with value: 1.649680931444815 and parameters: {'rebalance_frequency': 'ME', 'spy_weight': 0.95, 'gld_weight': 0.9000000000000001}. Best is trial 14 with value: 1.649680931444815.
2025-08-01 09:27:28,740 - INFO - Trial 107: Using cached value 1.649669 for duplicate parameters
[I 2025-08-01 09:27:28,757] Trial 107 finished with value: 1.6496694517073227 and parameters: {'rebalance_frequency': 'ME', 'spy_weight': 0.9000000000000001, 'gld_weight': 0.8500000000000001}. Best is trial 14 with value: 1.649680931444815.
2025-08-01 09:27:28,807 - INFO - Trial 108 started
[I 2025-08-01 09:27:30,680] Trial 108 finished with value: 1.6490388356607917 and parameters: {'rebalance_frequency': 'ME', 'spy_weight': 0.95, 'gld_weight': 0.95}. Best is trial 14 with value: 1.649680931444815.
2025-08-01 09:27:30,732 - INFO - Trial 109 started
[I 2025-08-01 09:27:32,621] Trial 109 finished with value: 1.6466350727400814 and parameters: {'rebalance_frequency': 'ME', 'spy_weight': 0.8500000000000001, 'gld_weight': 0.9000000000000001}. Best is trial 14 with value: 1.649680931444815.
2025-08-01 09:27:32,670 - INFO - Trial 110: Using cached value 1.649669 for duplicate parameters
[I 2025-08-01 09:27:32,690] Trial 110 finished with value: 1.6496694517073227 and parameters: {'rebalance_frequency': 'ME', 'spy_weight': 0.9000000000000001, 'gld_weight': 0.8500000000000001}. Best is trial 14 with value: 1.649680931444815.
2025-08-01 09:27:32,740 - INFO - Trial 111: Using cached value 1.649681 for duplicate parameters
[I 2025-08-01 09:27:32,758] Trial 111 finished with value: 1.649680931444815 and parameters: {'rebalance_frequency': 'ME', 'spy_weight': 0.95, 'gld_weight': 0.9000000000000001}. Best is trial 14 with value: 1.649680931444815.
2025-08-01 09:27:32,809 - INFO - Trial 112: Using cached value 1.649681 for duplicate parameters
[I 2025-08-01 09:27:32,830] Trial 112 finished with value: 1.649680931444815 and parameters: {'rebalance_frequency': 'ME', 'spy_weight': 0.95, 'gld_weight': 0.9000000000000001}. Best is trial 14 with value: 1.649680931444815.
2025-08-01 09:27:32,879 - INFO - Trial 113: Using cached value 1.649039 for duplicate parameters
[I 2025-08-01 09:27:32,897] Trial 113 finished with value: 1.6490388356607917 and parameters: {'rebalance_frequency': 'ME', 'spy_weight': 0.95, 'gld_weight': 0.95}. Best is trial 14 with value: 1.649680931444815.
2025-08-01 09:27:32,943 - INFO - Trial 114: Using cached value 1.649669 for duplicate parameters
[I 2025-08-01 09:27:32,963] Trial 114 finished with value: 1.6496694517073227 and parameters: {'rebalance_frequency': 'ME', 'spy_weight': 0.9000000000000001, 'gld_weight': 0.8500000000000001}. Best is trial 14 with value: 1.649680931444815.
2025-08-01 09:27:33,012 - INFO - Trial 115: Using cached value 1.649039 for duplicate parameters
[I 2025-08-01 09:27:33,030] Trial 115 finished with value: 1.6490388356607917 and parameters: {'rebalance_frequency': 'ME', 'spy_weight': 0.95, 'gld_weight': 0.95}. Best is trial 14 with value: 1.649680931444815.
2025-08-01 09:27:33,076 - INFO - Trial 116 started
[I 2025-08-01 09:27:33,794] Trial 116 finished with value: 1.6490388356607917 and parameters: {'rebalance_frequency': 'Q', 'spy_weight': 0.9000000000000001, 'gld_weight': 0.9000000000000001}. Best is trial 14 with value: 1.649680931444815.
2025-08-01 09:27:33,842 - INFO - Trial 117: Using cached value 1.645720 for duplicate parameters
[I 2025-08-01 09:27:33,862] Trial 117 finished with value: 1.6457203935909963 and parameters: {'rebalance_frequency': 'ME', 'spy_weight': 0.95, 'gld_weight': 0.8}. Best is trial 14 with value: 1.649680931444815.
2025-08-01 09:27:33,912 - INFO - Trial 118: Using cached value 1.649669 for duplicate parameters
[I 2025-08-01 09:27:33,930] Trial 118 finished with value: 1.6496694517073227 and parameters: {'rebalance_frequency': 'ME', 'spy_weight': 0.9000000000000001, 'gld_weight': 0.8500000000000001}. Best is trial 14 with value: 1.649680931444815.
2025-08-01 09:27:33,988 - INFO - Trial 119: Using cached value 1.646635 for duplicate parameters
[I 2025-08-01 09:27:34,007] Trial 119 finished with value: 1.6466350727400814 and parameters: {'rebalance_frequency': 'ME', 'spy_weight': 0.8500000000000001, 'gld_weight': 0.9000000000000001}. Best is trial 14 with value: 1.649680931444815.
2025-08-01 09:27:34,066 - INFO - Trial 120: Using cached value 1.649039 for duplicate parameters
[I 2025-08-01 09:27:34,085] Trial 120 finished with value: 1.6490388356607917 and parameters: {'rebalance_frequency': 'ME', 'spy_weight': 0.95, 'gld_weight': 0.95}. Best is trial 14 with value: 1.649680931444815.
2025-08-01 09:27:34,140 - INFO - Trial 121: Using cached value 1.649681 for duplicate parameters
[I 2025-08-01 09:27:34,159] Trial 121 finished with value: 1.649680931444815 and parameters: {'rebalance_frequency': 'ME', 'spy_weight': 0.95, 'gld_weight': 0.9000000000000001}. Best is trial 14 with value: 1.649680931444815.
2025-08-01 09:27:34,212 - INFO - Trial 122: Using cached value 1.649681 for duplicate parameters
[I 2025-08-01 09:27:34,231] Trial 122 finished with value: 1.649680931444815 and parameters: {'rebalance_frequency': 'ME', 'spy_weight': 0.95, 'gld_weight': 0.9000000000000001}. Best is trial 14 with value: 1.649680931444815.
2025-08-01 09:27:34,281 - INFO - Trial 123: Using cached value 1.649669 for duplicate parameters
[I 2025-08-01 09:27:34,300] Trial 123 finished with value: 1.6496694517073227 and parameters: {'rebalance_frequency': 'ME', 'spy_weight': 0.9000000000000001, 'gld_weight': 0.8500000000000001}. Best is trial 14 with value: 1.649680931444815.
2025-08-01 09:27:34,352 - INFO - Trial 124: Using cached value 1.649681 for duplicate parameters
[I 2025-08-01 09:27:34,372] Trial 124 finished with value: 1.649680931444815 and parameters: {'rebalance_frequency': 'ME', 'spy_weight': 0.95, 'gld_weight': 0.9000000000000001}. Best is trial 14 with value: 1.649680931444815.
2025-08-01 09:27:34,426 - INFO - Trial 125: Using cached value 1.649681 for duplicate parameters
[I 2025-08-01 09:27:34,444] Trial 125 finished with value: 1.649680931444815 and parameters: {'rebalance_frequency': 'ME', 'spy_weight': 0.95, 'gld_weight': 0.9000000000000001}. Best is trial 14 with value: 1.649680931444815.
2025-08-01 09:27:34,495 - INFO - Trial 126: Using cached value 1.646810 for duplicate parameters
[I 2025-08-01 09:27:34,513] Trial 126 finished with value: 1.6468102933675182 and parameters: {'rebalance_frequency': 'ME', 'spy_weight': 0.9000000000000001, 'gld_weight': 0.95}. Best is trial 14 with value: 1.649680931444815.
2025-08-01 09:27:34,566 - INFO - Trial 127 started
[I 2025-08-01 09:27:36,455] Trial 127 finished with value: 1.6486481853524118 and parameters: {'rebalance_frequency': 'ME', 'spy_weight': 0.95, 'gld_weight': 0.8500000000000001}. Best is trial 14 with value: 1.649680931444815.
2025-08-01 09:27:36,507 - INFO - Trial 128 started
[I 2025-08-01 09:27:38,469] Trial 128 finished with value: 1.6490388356607917 and parameters: {'rebalance_frequency': 'ME', 'spy_weight': 0.9000000000000001, 'gld_weight': 0.9000000000000001}. Best is trial 14 with value: 1.649680931444815.
2025-08-01 09:27:38,518 - INFO - Trial 129 started
[I 2025-08-01 09:27:40,472] Trial 129 finished with value: 1.6008989300160714 and parameters: {'rebalance_frequency': 'ME', 'spy_weight': 0.6500000000000001, 'gld_weight': 0.95}. Best is trial 14 with value: 1.649680931444815.
2025-08-01 09:27:40,519 - INFO - Trial 130 started
[I 2025-08-01 09:27:42,513] Trial 130 finished with value: 1.6496504132942078 and parameters: {'rebalance_frequency': 'ME', 'spy_weight': 0.8500000000000001, 'gld_weight': 0.8}. Best is trial 14 with value: 1.649680931444815.
2025-08-01 09:27:42,562 - INFO - Trial 131: Using cached value 1.649681 for duplicate parameters
[I 2025-08-01 09:27:42,579] Trial 131 finished with value: 1.649680931444815 and parameters: {'rebalance_frequency': 'ME', 'spy_weight': 0.95, 'gld_weight': 0.9000000000000001}. Best is trial 14 with value: 1.649680931444815.
2025-08-01 09:27:42,629 - INFO - Trial 132: Using cached value 1.649681 for duplicate parameters
[I 2025-08-01 09:27:42,647] Trial 132 finished with value: 1.649680931444815 and parameters: {'rebalance_frequency': 'ME', 'spy_weight': 0.95, 'gld_weight': 0.9000000000000001}. Best is trial 14 with value: 1.649680931444815.
2025-08-01 09:27:42,697 - INFO - Trial 133: Using cached value 1.648648 for duplicate parameters
[I 2025-08-01 09:27:42,717] Trial 133 finished with value: 1.6486481853524118 and parameters: {'rebalance_frequency': 'ME', 'spy_weight': 0.95, 'gld_weight': 0.8500000000000001}. Best is trial 14 with value: 1.649680931444815.
2025-08-01 09:27:42,766 - INFO - Trial 134: Using cached value 1.649039 for duplicate parameters
[I 2025-08-01 09:27:42,783] Trial 134 finished with value: 1.6490388356607917 and parameters: {'rebalance_frequency': 'ME', 'spy_weight': 0.9000000000000001, 'gld_weight': 0.9000000000000001}. Best is trial 14 with value: 1.649680931444815.
2025-08-01 09:27:42,833 - INFO - Trial 135: Using cached value 1.649039 for duplicate parameters
[I 2025-08-01 09:27:42,852] Trial 135 finished with value: 1.6490388356607917 and parameters: {'rebalance_frequency': 'ME', 'spy_weight': 0.95, 'gld_weight': 0.95}. Best is trial 14 with value: 1.649680931444815.
2025-08-01 09:27:42,901 - INFO - Trial 136 started
[I 2025-08-01 09:27:44,779] Trial 136 finished with value: 1.5332793200066668 and parameters: {'rebalance_frequency': 'ME', 'spy_weight': 0.45, 'gld_weight': 0.8500000000000001}. Best is trial 14 with value: 1.649680931444815.
2025-08-01 09:27:44,827 - INFO - Trial 137: Using cached value 1.649681 for duplicate parameters
[I 2025-08-01 09:27:44,844] Trial 137 finished with value: 1.649680931444815 and parameters: {'rebalance_frequency': 'ME', 'spy_weight': 0.95, 'gld_weight': 0.9000000000000001}. Best is trial 14 with value: 1.649680931444815.
2025-08-01 09:27:44,890 - INFO - Trial 138 started
[I 2025-08-01 09:27:45,618] Trial 138 finished with value: 1.6304247088474564 and parameters: {'rebalance_frequency': 'Q', 'spy_weight': 0.9000000000000001, 'gld_weight': 0.6500000000000001}. Best is trial 14 with value: 1.649680931444815.
2025-08-01 09:27:45,671 - INFO - Trial 139: Using cached value 1.649039 for duplicate parameters
[I 2025-08-01 09:27:45,691] Trial 139 finished with value: 1.6490388356607917 and parameters: {'rebalance_frequency': 'ME', 'spy_weight': 0.95, 'gld_weight': 0.95}. Best is trial 14 with value: 1.649680931444815.
2025-08-01 09:27:45,743 - INFO - Trial 140: Using cached value 1.649039 for duplicate parameters
[I 2025-08-01 09:27:45,761] Trial 140 finished with value: 1.6490388356607917 and parameters: {'rebalance_frequency': 'ME', 'spy_weight': 0.9000000000000001, 'gld_weight': 0.9000000000000001}. Best is trial 14 with value: 1.649680931444815.
2025-08-01 09:27:45,812 - INFO - Trial 141: Using cached value 1.649681 for duplicate parameters
[I 2025-08-01 09:27:45,830] Trial 141 finished with value: 1.649680931444815 and parameters: {'rebalance_frequency': 'ME', 'spy_weight': 0.95, 'gld_weight': 0.9000000000000001}. Best is trial 14 with value: 1.649680931444815.
2025-08-01 09:27:45,880 - INFO - Trial 142: Using cached value 1.648648 for duplicate parameters
[I 2025-08-01 09:27:45,900] Trial 142 finished with value: 1.6486481853524118 and parameters: {'rebalance_frequency': 'ME', 'spy_weight': 0.95, 'gld_weight': 0.8500000000000001}. Best is trial 14 with value: 1.649680931444815.
2025-08-01 09:27:45,951 - INFO - Trial 143: Using cached value 1.649681 for duplicate parameters
[I 2025-08-01 09:27:45,970] Trial 143 finished with value: 1.649680931444815 and parameters: {'rebalance_frequency': 'ME', 'spy_weight': 0.95, 'gld_weight': 0.9000000000000001}. Best is trial 14 with value: 1.649680931444815.
2025-08-01 09:27:46,018 - INFO - Trial 144: Using cached value 1.646810 for duplicate parameters
[I 2025-08-01 09:27:46,035] Trial 144 finished with value: 1.6468102933675182 and parameters: {'rebalance_frequency': 'ME', 'spy_weight': 0.9000000000000001, 'gld_weight': 0.95}. Best is trial 14 with value: 1.649680931444815.
2025-08-01 09:27:46,083 - INFO - Trial 145: Using cached value 1.649681 for duplicate parameters
[I 2025-08-01 09:27:46,101] Trial 145 finished with value: 1.649680931444815 and parameters: {'rebalance_frequency': 'ME', 'spy_weight': 0.95, 'gld_weight': 0.9000000000000001}. Best is trial 14 with value: 1.649680931444815.
2025-08-01 09:27:46,151 - INFO - Trial 146: Using cached value 1.648648 for duplicate parameters
[I 2025-08-01 09:27:46,169] Trial 146 finished with value: 1.6486481853524118 and parameters: {'rebalance_frequency': 'ME', 'spy_weight': 0.95, 'gld_weight': 0.8500000000000001}. Best is trial 14 with value: 1.649680931444815.
2025-08-01 09:27:46,219 - INFO - Trial 147: Using cached value 1.649039 for duplicate parameters
[I 2025-08-01 09:27:46,236] Trial 147 finished with value: 1.6490388356607917 and parameters: {'rebalance_frequency': 'ME', 'spy_weight': 0.9000000000000001, 'gld_weight': 0.9000000000000001}. Best is trial 14 with value: 1.649680931444815.
2025-08-01 09:27:46,284 - INFO - Trial 148 started
[I 2025-08-01 09:27:48,385] Trial 148 finished with value: 1.1875158657146612 and parameters: {'rebalance_frequency': 'ME', 'spy_weight': 0.15000000000000002, 'gld_weight': 0.95}. Best is trial 14 with value: 1.649680931444815.
2025-08-01 09:27:48,437 - INFO - Trial 149: Using cached value 1.649681 for duplicate parameters
[I 2025-08-01 09:27:48,455] Trial 149 finished with value: 1.649680931444815 and parameters: {'rebalance_frequency': 'ME', 'spy_weight': 0.95, 'gld_weight': 0.9000000000000001}. Best is trial 14 with value: 1.649680931444815.
2025-08-01 09:27:48,508 - INFO - Trial 150: Using cached value 1.649669 for duplicate parameters
[I 2025-08-01 09:27:48,526] Trial 150 finished with value: 1.6496694517073227 and parameters: {'rebalance_frequency': 'ME', 'spy_weight': 0.9000000000000001, 'gld_weight': 0.8500000000000001}. Best is trial 14 with value: 1.649680931444815.
2025-08-01 09:27:48,574 - INFO - Trial 151: Using cached value 1.649681 for duplicate parameters
[I 2025-08-01 09:27:48,595] Trial 151 finished with value: 1.649680931444815 and parameters: {'rebalance_frequency': 'ME', 'spy_weight': 0.95, 'gld_weight': 0.9000000000000001}. Best is trial 14 with value: 1.649680931444815.
2025-08-01 09:27:48,644 - INFO - Trial 152: Using cached value 1.649681 for duplicate parameters
[I 2025-08-01 09:27:48,662] Trial 152 finished with value: 1.649680931444815 and parameters: {'rebalance_frequency': 'ME', 'spy_weight': 0.95, 'gld_weight': 0.9000000000000001}. Best is trial 14 with value: 1.649680931444815.
2025-08-01 09:27:48,714 - INFO - Trial 153: Using cached value 1.649039 for duplicate parameters
[I 2025-08-01 09:27:48,733] Trial 153 finished with value: 1.6490388356607917 and parameters: {'rebalance_frequency': 'ME', 'spy_weight': 0.95, 'gld_weight': 0.95}. Best is trial 14 with value: 1.649680931444815.
2025-08-01 09:27:48,785 - INFO - Trial 154: Using cached value 1.649039 for duplicate parameters
[I 2025-08-01 09:27:48,805] Trial 154 finished with value: 1.6490388356607917 and parameters: {'rebalance_frequency': 'ME', 'spy_weight': 0.9000000000000001, 'gld_weight': 0.9000000000000001}. Best is trial 14 with value: 1.649680931444815.
2025-08-01 09:27:48,855 - INFO - Trial 155 started
[I 2025-08-01 09:27:50,903] Trial 155 finished with value: 1.5923891652480853 and parameters: {'rebalance_frequency': 'ME', 'spy_weight': 0.95, 'gld_weight': 0.55}. Best is trial 14 with value: 1.649680931444815.
2025-08-01 09:27:50,954 - INFO - Trial 156: Using cached value 1.649669 for duplicate parameters
[I 2025-08-01 09:27:50,973] Trial 156 finished with value: 1.6496694517073227 and parameters: {'rebalance_frequency': 'ME', 'spy_weight': 0.9000000000000001, 'gld_weight': 0.8500000000000001}. Best is trial 14 with value: 1.649680931444815.
2025-08-01 09:27:51,025 - INFO - Trial 157: Using cached value 1.649039 for duplicate parameters
[I 2025-08-01 09:27:51,044] Trial 157 finished with value: 1.6490388356607917 and parameters: {'rebalance_frequency': 'ME', 'spy_weight': 0.95, 'gld_weight': 0.95}. Best is trial 14 with value: 1.649680931444815.
2025-08-01 09:27:51,096 - INFO - Trial 158 started
[I 2025-08-01 09:27:53,064] Trial 158 finished with value: 1.6484208929305986 and parameters: {'rebalance_frequency': 'ME', 'spy_weight': 0.9000000000000001, 'gld_weight': 0.8}. Best is trial 14 with value: 1.649680931444815.
2025-08-01 09:27:53,117 - INFO - Trial 159 started
[I 2025-08-01 09:27:53,861] Trial 159 finished with value: 1.649680931444815 and parameters: {'rebalance_frequency': 'Q', 'spy_weight': 0.95, 'gld_weight': 0.9000000000000001}. Best is trial 14 with value: 1.649680931444815.
2025-08-01 09:27:53,911 - INFO - Trial 160: Using cached value 1.648648 for duplicate parameters
[I 2025-08-01 09:27:53,930] Trial 160 finished with value: 1.6486481853524118 and parameters: {'rebalance_frequency': 'ME', 'spy_weight': 0.95, 'gld_weight': 0.8500000000000001}. Best is trial 14 with value: 1.649680931444815.
2025-08-01 09:27:53,983 - INFO - Trial 161: Using cached value 1.649681 for duplicate parameters
[I 2025-08-01 09:27:54,001] Trial 161 finished with value: 1.649680931444815 and parameters: {'rebalance_frequency': 'ME', 'spy_weight': 0.95, 'gld_weight': 0.9000000000000001}. Best is trial 14 with value: 1.649680931444815.
2025-08-01 09:27:54,093 - INFO - Trial 162: Using cached value 1.649681 for duplicate parameters
[I 2025-08-01 09:27:54,112] Trial 162 finished with value: 1.649680931444815 and parameters: {'rebalance_frequency': 'ME', 'spy_weight': 0.95, 'gld_weight': 0.9000000000000001}. Best is trial 14 with value: 1.649680931444815.
2025-08-01 09:27:54,167 - INFO - Trial 163: Using cached value 1.649039 for duplicate parameters
