[I 2025-08-01 09:27:54,186] Trial 163 finished with value: 1.6490388356607917 and parameters: {'rebalance_frequency': 'ME', 'spy_weight': 0.9000000000000001, 'gld_weight': 0.9000000000000001}. Best is trial 14 with value: 1.649680931444815.
2025-08-01 09:27:54,237 - INFO - Trial 164: Using cached value 1.649039 for duplicate parameters
[I 2025-08-01 09:27:54,254] Trial 164 finished with value: 1.6490388356607917 and parameters: {'rebalance_frequency': 'ME', 'spy_weight': 0.95, 'gld_weight': 0.95}. Best is trial 14 with value: 1.649680931444815.
2025-08-01 09:27:54,307 - INFO - Trial 165: Using cached value 1.649681 for duplicate parameters
[I 2025-08-01 09:27:54,327] Trial 165 finished with value: 1.649680931444815 and parameters: {'rebalance_frequency': 'ME', 'spy_weight': 0.95, 'gld_weight': 0.9000000000000001}. Best is trial 14 with value: 1.649680931444815.
2025-08-01 09:27:54,377 - INFO - Trial 166 started
[I 2025-08-01 09:27:56,343] Trial 166 finished with value: 1.2796987576179564 and parameters: {'rebalance_frequency': 'ME', 'spy_weight': 0.55, 'gld_weight': 0.05}. Best is trial 14 with value: 1.649680931444815.
2025-08-01 09:27:56,393 - INFO - Trial 167: Using cached value 1.648648 for duplicate parameters
[I 2025-08-01 09:27:56,412] Trial 167 finished with value: 1.6486481853524118 and parameters: {'rebalance_frequency': 'ME', 'spy_weight': 0.95, 'gld_weight': 0.8500000000000001}. Best is trial 14 with value: 1.649680931444815.
2025-08-01 09:27:56,464 - INFO - Trial 168 started
[I 2025-08-01 09:27:56,749] Trial 168 finished with value: 1.6468102933675182 and parameters: {'rebalance_frequency': 'A', 'spy_weight': 0.9000000000000001, 'gld_weight': 0.95}. Best is trial 14 with value: 1.649680931444815.
2025-08-01 09:27:56,809 - INFO - Trial 169: Using cached value 1.649681 for duplicate parameters
[I 2025-08-01 09:27:56,829] Trial 169 finished with value: 1.649680931444815 and parameters: {'rebalance_frequency': 'ME', 'spy_weight': 0.95, 'gld_weight': 0.9000000000000001}. Best is trial 14 with value: 1.649680931444815.
2025-08-01 09:27:56,884 - INFO - Trial 170: Using cached value 1.649669 for duplicate parameters
[I 2025-08-01 09:27:56,903] Trial 170 finished with value: 1.6496694517073227 and parameters: {'rebalance_frequency': 'ME', 'spy_weight': 0.9000000000000001, 'gld_weight': 0.8500000000000001}. Best is trial 14 with value: 1.649680931444815.
2025-08-01 09:27:56,961 - INFO - Trial 171: Using cached value 1.649681 for duplicate parameters
[I 2025-08-01 09:27:56,982] Trial 171 finished with value: 1.649680931444815 and parameters: {'rebalance_frequency': 'ME', 'spy_weight': 0.95, 'gld_weight': 0.9000000000000001}. Best is trial 14 with value: 1.649680931444815.
2025-08-01 09:27:57,048 - INFO - Trial 172: Using cached value 1.649681 for duplicate parameters
[I 2025-08-01 09:27:57,071] Trial 172 finished with value: 1.649680931444815 and parameters: {'rebalance_frequency': 'ME', 'spy_weight': 0.95, 'gld_weight': 0.9000000000000001}. Best is trial 14 with value: 1.649680931444815.
2025-08-01 09:27:57,126 - INFO - Trial 173: Using cached value 1.649681 for duplicate parameters
[I 2025-08-01 09:27:57,144] Trial 173 finished with value: 1.649680931444815 and parameters: {'rebalance_frequency': 'ME', 'spy_weight': 0.95, 'gld_weight': 0.9000000000000001}. Best is trial 14 with value: 1.649680931444815.
2025-08-01 09:27:57,196 - INFO - Trial 174: Using cached value 1.649039 for duplicate parameters
[I 2025-08-01 09:27:57,216] Trial 174 finished with value: 1.6490388356607917 and parameters: {'rebalance_frequency': 'ME', 'spy_weight': 0.95, 'gld_weight': 0.95}. Best is trial 14 with value: 1.649680931444815.
2025-08-01 09:27:57,284 - INFO - Trial 175: Using cached value 1.649681 for duplicate parameters
[I 2025-08-01 09:27:57,308] Trial 175 finished with value: 1.649680931444815 and parameters: {'rebalance_frequency': 'ME', 'spy_weight': 0.95, 'gld_weight': 0.9000000000000001}. Best is trial 14 with value: 1.649680931444815.
2025-08-01 09:27:57,359 - INFO - Trial 176: Using cached value 1.649669 for duplicate parameters
[I 2025-08-01 09:27:57,376] Trial 176 finished with value: 1.6496694517073227 and parameters: {'rebalance_frequency': 'ME', 'spy_weight': 0.9000000000000001, 'gld_weight': 0.8500000000000001}. Best is trial 14 with value: 1.649680931444815.
2025-08-01 09:27:57,425 - INFO - Trial 177: Using cached value 1.646810 for duplicate parameters
[I 2025-08-01 09:27:57,443] Trial 177 finished with value: 1.6468102933675182 and parameters: {'rebalance_frequency': 'ME', 'spy_weight': 0.9000000000000001, 'gld_weight': 0.95}. Best is trial 14 with value: 1.649680931444815.
2025-08-01 09:27:57,494 - INFO - Trial 178: Using cached value 1.649681 for duplicate parameters
[I 2025-08-01 09:27:57,514] Trial 178 finished with value: 1.649680931444815 and parameters: {'rebalance_frequency': 'ME', 'spy_weight': 0.95, 'gld_weight': 0.9000000000000001}. Best is trial 14 with value: 1.649680931444815.
2025-08-01 09:27:57,566 - INFO - Trial 179: Using cached value 1.648648 for duplicate parameters
[I 2025-08-01 09:27:57,583] Trial 179 finished with value: 1.6486481853524118 and parameters: {'rebalance_frequency': 'ME', 'spy_weight': 0.95, 'gld_weight': 0.8500000000000001}. Best is trial 14 with value: 1.649680931444815.
2025-08-01 09:27:57,633 - INFO - Trial 180: Using cached value 1.646810 for duplicate parameters
[I 2025-08-01 09:27:57,652] Trial 180 finished with value: 1.6468102933675182 and parameters: {'rebalance_frequency': 'ME', 'spy_weight': 0.9000000000000001, 'gld_weight': 0.95}. Best is trial 14 with value: 1.649680931444815.
2025-08-01 09:27:57,708 - INFO - Trial 181: Using cached value 1.649681 for duplicate parameters
[I 2025-08-01 09:27:57,728] Trial 181 finished with value: 1.649680931444815 and parameters: {'rebalance_frequency': 'ME', 'spy_weight': 0.95, 'gld_weight': 0.9000000000000001}. Best is trial 14 with value: 1.649680931444815.
2025-08-01 09:27:57,782 - INFO - Trial 182: Using cached value 1.649681 for duplicate parameters
[I 2025-08-01 09:27:57,802] Trial 182 finished with value: 1.649680931444815 and parameters: {'rebalance_frequency': 'ME', 'spy_weight': 0.95, 'gld_weight': 0.9000000000000001}. Best is trial 14 with value: 1.649680931444815.
2025-08-01 09:27:57,851 - INFO - Trial 183: Using cached value 1.649681 for duplicate parameters
[I 2025-08-01 09:27:57,869] Trial 183 finished with value: 1.649680931444815 and parameters: {'rebalance_frequency': 'ME', 'spy_weight': 0.95, 'gld_weight': 0.9000000000000001}. Best is trial 14 with value: 1.649680931444815.
2025-08-01 09:27:57,917 - INFO - Trial 184: Using cached value 1.648648 for duplicate parameters
[I 2025-08-01 09:27:57,937] Trial 184 finished with value: 1.6486481853524118 and parameters: {'rebalance_frequency': 'ME', 'spy_weight': 0.95, 'gld_weight': 0.8500000000000001}. Best is trial 14 with value: 1.649680931444815.
2025-08-01 09:27:57,985 - INFO - Trial 185: Using cached value 1.649039 for duplicate parameters
[I 2025-08-01 09:27:58,003] Trial 185 finished with value: 1.6490388356607917 and parameters: {'rebalance_frequency': 'ME', 'spy_weight': 0.9000000000000001, 'gld_weight': 0.9000000000000001}. Best is trial 14 with value: 1.649680931444815.
2025-08-01 09:27:58,054 - INFO - Trial 186: Using cached value 1.649039 for duplicate parameters
[I 2025-08-01 09:27:58,072] Trial 186 finished with value: 1.6490388356607917 and parameters: {'rebalance_frequency': 'ME', 'spy_weight': 0.95, 'gld_weight': 0.95}. Best is trial 14 with value: 1.649680931444815.
2025-08-01 09:27:58,123 - INFO - Trial 187: Using cached value 1.649681 for duplicate parameters
[I 2025-08-01 09:27:58,142] Trial 187 finished with value: 1.649680931444815 and parameters: {'rebalance_frequency': 'ME', 'spy_weight': 0.95, 'gld_weight': 0.9000000000000001}. Best is trial 14 with value: 1.649680931444815.
2025-08-01 09:27:58,196 - INFO - Trial 188: Using cached value 1.649669 for duplicate parameters
[I 2025-08-01 09:27:58,214] Trial 188 finished with value: 1.6496694517073227 and parameters: {'rebalance_frequency': 'ME', 'spy_weight': 0.9000000000000001, 'gld_weight': 0.8500000000000001}. Best is trial 14 with value: 1.649680931444815.
2025-08-01 09:27:58,263 - INFO - Trial 189: Using cached value 1.649039 for duplicate parameters
[I 2025-08-01 09:27:58,281] Trial 189 finished with value: 1.6490388356607917 and parameters: {'rebalance_frequency': 'ME', 'spy_weight': 0.95, 'gld_weight': 0.95}. Best is trial 14 with value: 1.649680931444815.
2025-08-01 09:27:58,334 - INFO - Trial 190: Using cached value 1.649681 for duplicate parameters
[I 2025-08-01 09:27:58,353] Trial 190 finished with value: 1.649680931444815 and parameters: {'rebalance_frequency': 'Q', 'spy_weight': 0.95, 'gld_weight': 0.9000000000000001}. Best is trial 14 with value: 1.649680931444815.
2025-08-01 09:27:58,406 - INFO - Trial 191: Using cached value 1.649681 for duplicate parameters
[I 2025-08-01 09:27:58,424] Trial 191 finished with value: 1.649680931444815 and parameters: {'rebalance_frequency': 'ME', 'spy_weight': 0.95, 'gld_weight': 0.9000000000000001}. Best is trial 14 with value: 1.649680931444815.
2025-08-01 09:27:58,475 - INFO - Trial 192 started
[I 2025-08-01 09:28:00,399] Trial 192 finished with value: 1.548553240422263 and parameters: {'rebalance_frequency': 'ME', 'spy_weight': 0.95, 'gld_weight': 0.45}. Best is trial 14 with value: 1.649680931444815.
2025-08-01 09:28:00,451 - INFO - Trial 193: Using cached value 1.649681 for duplicate parameters
[I 2025-08-01 09:28:00,469] Trial 193 finished with value: 1.649680931444815 and parameters: {'rebalance_frequency': 'ME', 'spy_weight': 0.95, 'gld_weight': 0.9000000000000001}. Best is trial 14 with value: 1.649680931444815.
2025-08-01 09:28:00,518 - INFO - Trial 194: Using cached value 1.649039 for duplicate parameters
[I 2025-08-01 09:28:00,541] Trial 194 finished with value: 1.6490388356607917 and parameters: {'rebalance_frequency': 'ME', 'spy_weight': 0.9000000000000001, 'gld_weight': 0.9000000000000001}. Best is trial 14 with value: 1.649680931444815.
2025-08-01 09:28:00,596 - INFO - Trial 195: Using cached value 1.648648 for duplicate parameters
[I 2025-08-01 09:28:00,614] Trial 195 finished with value: 1.6486481853524118 and parameters: {'rebalance_frequency': 'ME', 'spy_weight': 0.95, 'gld_weight': 0.8500000000000001}. Best is trial 14 with value: 1.649680931444815.
2025-08-01 09:28:00,662 - INFO - Trial 196: Using cached value 1.649039 for duplicate parameters
[I 2025-08-01 09:28:00,680] Trial 196 finished with value: 1.6490388356607917 and parameters: {'rebalance_frequency': 'ME', 'spy_weight': 0.9000000000000001, 'gld_weight': 0.9000000000000001}. Best is trial 14 with value: 1.649680931444815.
2025-08-01 09:28:00,730 - INFO - Trial 197: Using cached value 1.649039 for duplicate parameters
[I 2025-08-01 09:28:00,747] Trial 197 finished with value: 1.6490388356607917 and parameters: {'rebalance_frequency': 'ME', 'spy_weight': 0.95, 'gld_weight': 0.95}. Best is trial 14 with value: 1.649680931444815.
2025-08-01 09:28:00,797 - INFO - Trial 198: Using cached value 1.648648 for duplicate parameters
[I 2025-08-01 09:28:00,815] Trial 198 finished with value: 1.6486481853524118 and parameters: {'rebalance_frequency': 'ME', 'spy_weight': 0.95, 'gld_weight': 0.8500000000000001}. Best is trial 14 with value: 1.649680931444815.
2025-08-01 09:28:00,863 - INFO - Trial 199 started
[I 2025-08-01 09:28:02,745] Trial 199 finished with value: 1.468875251626124 and parameters: {'rebalance_frequency': 'ME', 'spy_weight': 0.9000000000000001, 'gld_weight': 0.3}. Best is trial 14 with value: 1.649680931444815.
2025-08-01 09:28:02,745 - INFO - Worker 1004 finished
[I 2025-08-01 09:28:02,783] Using an existing study with name 'fixed_weight_spy_gld_sortino_optimization_optuna' instead of creating a new one.
2025-08-01 09:28:08,251 - INFO - Generating performance report …
                            Full-Period Performance                            
┌─────────────────────────────┬──────────────────────────────────┬────────────┐
│ Metric                      │ fixed_weight_spy_gld_sortino_op… │ SPY        │
├─────────────────────────────┼──────────────────────────────────┼────────────┤
│ Total Return                │ 241.28%                          │ 425.30%    │
│ Ann. Return                 │ 10.42%                           │ 14.29%     │
│ Ann. Vol                    │ 0.1173                           │ 0.1716     │
│ Sharpe                      │ 0.8883                           │ 0.8328     │
│ Sortino                     │ 1.2851                           │ 1.2180     │
│ Calmar                      │ 0.5056                           │ 0.4238     │
│ Alpha (ann)                 │ 0.0289                           │ -0.0000    │
│ Beta                        │ 0.5299                           │ 1.0000     │
│ Max Drawdown                │ -0.2061                          │ -0.3372    │
│ VaR (5%)                    │ -0.0109                          │ -0.0162    │
│ CVaR (5%)                   │ -0.0172                          │ -0.0261    │
│ Tail Ratio                  │ 0.8687                           │ 0.8011     │
│ Avg DD Duration             │ 17.3813                          │ 11.2596    │
│ Avg Recovery Time           │ 1.0000                           │ 1.0043     │
│ Skew                        │ -0.2297                          │ -0.3244    │
│ Kurtosis                    │ 12.8409                          │ 14.5975    │
│ R^2                         │ 0.6024                           │ 1.0000     │
│ K-Ratio                     │ 12688.7554                       │ 18515.9082 │
│ ADF Statistic               │ 3.2630                           │ 0.9863     │
│ ADF p-value                 │ 1.000000                         │ 0.994120   │
│ Deflated Sharpe             │ 1.0000                           │ 1.0000     │
│ Max DD Recovery Time (days) │ 445                              │ 708        │
│ Max Flat Period (days)      │ 21                               │ 1          │
└─────────────────────────────┴──────────────────────────────────┴────────────┘


                         Trade Statistics -                         
        fixed_weight_spy_gld_sortino_optimization_Optimized         
┌───────────────────────┬─────────────┬─────────────┬──────────────┐
│ Metric                │  All Trades │ Long Trades │ Short Trades │
├───────────────────────┼─────────────┼─────────────┼──────────────┤
│ Number of Trades      │           2 │           2 │            0 │
│ Number of Winners     │           2 │           2 │            0 │
│ Number of Losers      │ 2025-08-01 09:28:08,493 - INFO - Performance metrics saved to data\reports\fixed_weight_spy_gld_sortino_optimization_20250801_092808\performance_metrics.csv
          0 │2025-08-01 09:28:08,494 - INFO - Optimal parameters for fixed_weight_spy_gld_sortino_optimization_Optimized saved to data\reports\fixed_weight_spy_gld_sortino_optimization_20250801_092808\optimal_params_fixed_weight_spy_gld_sortino_optimization_Optimized.txt
           0 │            0 │
│ Win Rate (%)          │     100.00% │     100.00% │        0.00% │
│ Total P&L Net         │ $252,359.59 │ $252,359.59 │        $0.00 │
2025-08-01 09:28:08,499 - INFO - Transaction history for fixed_weight_spy_gld_sortino_optimization_Optimized saved to data\reports\fixed_weight_spy_gld_sortino_optimization_20250801_092808\transaction_history_fixed_weight_spy_gld_sortino_optimization_Optimized.csv
│ Largest Single Profit │ $209,155.85 │ $209,155.85 │        $0.00 │
│ Largest Single Loss   │       $0.00 │       $0.00 │        $0.00 │
│ Mean Profit           │ $126,179.79 │ $126,179.79 │        $0.00 │
│ Mean Loss             │       $0.00 │       $0.00 │        $0.00 │
│ Mean Trade P&L        │ $126,179.79 │ $126,179.79 │        $0.00 │
│ Reward/Risk Ratio     │           ∞ │           ∞ │        0.000 │
│ Commissions Paid      │       $0.00 │       $0.00 │        $0.00 │
│ Avg MFE               │ $127,906.38 │ $127,906.38 │        $0.00 │
│ Avg MAE               │  $-9,564.20 │  $-9,564.20 │        $0.00 │
│ Min Duration (days)   │        4532 │        4532 │            0 │
│ Max Duration (days)   │        4532 │        4532 │            0 │
│ Mean Duration (days)  │     4532.00 │     4532.00 │         0.00 │
│ Information Score     │       1.558 │       1.558 │        0.000 │
│ Trades per Month      │        0.01 │        0.01 │         0.00 │
│                       │             │             │              │
│ Max Margin Load       │     100.00% │     100.00% │      100.00% │
│ Mean Margin Load      │      99.33% │      99.33% │       99.33% │
└───────────────────────┴─────────────┴─────────────┴──────────────┘
           Optimal Parameters for           
fixed_weight_spy_gld_sortino_optimization_Op
                  timized                   
┌─────────────────────┬────────────────────┐
│ Parameter           │ Value              │
├─────────────────────┼────────────────────┤
│ rebalance_frequency │ ME                 │
│ spy_weight          │ 0.95               │
│ gld_weight          │ 0.9000000000000001 │
└─────────────────────┴────────────────────┘
2025-08-01 09:28:09,259 - INFO - Performance plot saved to: plots\performance_summary_fixed_weight_spy_gld_sortino_optimization_20250801_092809.png
2025-08-01 09:28:09,272 - INFO - Performance plots generated and saved.
2025-08-01 09:28:09,333 - INFO - Performance summary saved to data\reports\fixed_weight_spy_gld_sortino_optimization_20250801_092808\equity_curve.png
2025-08-01 09:28:09,566 - INFO - Trade price plot saved to data\reports\fixed_weight_spy_gld_sortino_optimization_20250801_092808\price_with_trades_fixed_weight_spy_gld_sortino_optimization_Optimized_SPY.png
2025-08-01 09:28:09,807 - INFO - Trade price plot saved to data\reports\fixed_weight_spy_gld_sortino_optimization_20250801_092808\price_with_trades_fixed_weight_spy_gld_sortino_optimization_Optimized_GLD.png
2025-08-01 09:28:09,821 - INFO - Backtester run completed.
Running: C:\Users\Mateusz\source\repos\portfolio-backtester\.venv\Scripts\python.exe -m cProfile -o profile_optuna.prof -m src.portfolio_backtester.backtester --mode optimize --scenario-name fixed_weight_spy_gld_sortino_optimization --optuna-trials 1 --n-jobs 1

Profile saved to C:\Users\Mateusz\source\repos\portfolio-backtester\profile_optuna.prof
